<?xml version="1.0" encoding="UTF-8"?>
<!--
 *       -*- OpenSAF  -*-
 * 
 *  (C) Copyright 2008 The OpenSAF Foundation 
 * 
 *  This program is distributed in the hope that it will be useful, but
 *  WITHOUT ANY WARRANTY; without even the implied warranty of MERCHANTABILITY 
 *  or FITNESS FOR A PARTICULAR PURPOSE. This file and program are licensed
 *  under the GNU Lesser General Public License Version 2.1, February 1999.
 *  The complete license can be accessed from the following location:
 *  http://opensource.org/licenses/lgpl-license.php 
 *  See the Copying file included with the OpenSAF distribution for full
 *  licensing terms.
 * 
 *  Author(s): Emerson Network Power
 *
-->
<!--Sample XML file generated by XMLSPY v2004 rel. 3 U (http://www.xmlspy.com)-->
<ValidationConfig xmlns:xsi="http://www.w3.org/2001/XMLSchema-instance" xsi:noNamespaceSchemaLocation="ValidationConfig.xsd">
 
	<EntityTypeInstance IsNode="1" Name="CHASSIS" HPIEntityType="SAHPI_ENT_SYSTEM_CHASSIS">
	        <LocationRange ParentEntityTypeInstanceName="ROOT" LocationRegularExpression="1..16"/>
	        <FRUActivationPolicy Applicable="1">
	               <FruInformation ProductVersion="Rev. 01" ProductName="SYS-CONTLR" />
	        </FRUActivationPolicy>
	        <FaultDomain>FAULTDOMAIN_TYPE_SELF</FaultDomain>
        </EntityTypeInstance> 	

	<EntityTypeInstance IsNode="1" Name="CONTROLLER_1" HPIEntityType="SAHPI_ENT_SYSTEM_BOARD">
		<LocationRange ParentEntityTypeInstanceName="CHASSIS" LocationRegularExpression="1..2"/>
		<FRUActivationPolicy Applicable="1">
			<FruInformation ProductVersion="Rev. 01" ProductName="SYS-CONTLR" />
		</FRUActivationPolicy>
		<FaultDomain>FAULTDOMAIN_TYPE_SELF</FaultDomain>
	</EntityTypeInstance>

	<EntityTypeInstance IsNode="1" Name="CONTROLLER_2" HPIEntityType="SAHPI_ENT_SYSTEM_BOARD">
		<LocationRange ParentEntityTypeInstanceName="CHASSIS" LocationRegularExpression="1..2"/>
		<FRUActivationPolicy Applicable="1">
			<FruInformation ProductVersion="Rev. 01" ProductName="SYS-CONTLR" />
		</FRUActivationPolicy>
		<FaultDomain>FAULTDOMAIN_TYPE_SELF</FaultDomain>
	</EntityTypeInstance>
	
	<EntityTypeInstance IsNode="1" Name="PAYLOAD_PC" HPIEntityType="SAHPI_ENT_SYSTEM_BOARD">
			<LocationRange ParentEntityTypeInstanceName="CHASSIS" LocationRegularExpression="3..16"/>
			<FRUActivationPolicy Applicable="1">
				<FruInformation ProductVersion="Rev. 01" ProductName="PAYLOAD-PC" />
			</FRUActivationPolicy>
			<FaultDomain>FAULTDOMAIN_TYPE_SELF</FaultDomain>
	</EntityTypeInstance>

  
</ValidationConfig>



